{
  "name": "JAXA सगामिहारा अंतरिक्ष विज्ञान प्रदर्शनी हॉल",
  "city": "सगामिहारा",
  "description": "JAXA के अंतरिक्ष एवं अंतरिक्षयात्रा विज्ञान संस्थान का प्रदर्शनी हॉल, जो जापान के विज्ञान मिशन चलाता है, जिनमें Hayabusa और Hayabusa2 शामिल हैं।",
  "items": {
    "hayabusa-2": "Hayabusa2 की वापसी कैप्सूल, जो क्षुद्रग्रह Ryugu के नमूने पृथ्वी पर लाई (2020)"
  }
}
