{
  "name": "Национальный музей воздухоплавания и астронавтики",
  "city": "Вашингтон",
  "description": "Национальный музей авиации и космонавтики при Смитсоновском институте, на Национальной аллее.",
  "items": {
    "apollo-csm-block-ii": "Командный модуль Columbia, летавший на Apollo 11 (1969)",
    "apollo-lm": "Лунный модуль LM-2, построенный для полёта, но ни разу не летавший",
    "gemini": "Капсула Gemini IV, летавшая в первой американской миссии с выходом в открытый космос (1965)",
    "mercury-capsule": "Friendship 7, на которой летал Джон Гленн в первом американском орбитальном полёте (1962)",
    "/science/history/apollo-11-1969": "Командный модуль Columbia, летавший на Apollo 11",
    "merlin-1d": "Двигатель Merlin 1D, побывавший в полёте, переданный компанией SpaceX в 2022 году",
    "sojourner": "Marie Curie, лётный дублёр ровера Sojourner",
    "tundra-sirius": "Sirius FM-4, готовый к полёту спутник, который так и не был запущен",
    "planet-labs": "Один из первых спутников Dove, лётный экземпляр, переданный компанией Planet Labs",
    "skylab": "Резервная орбитальная станция Skylab, по которой можно пройти"
  }
}
