{
  "name": "Virginia Air & Space Science Center",
  "city": "Hampton, Virginia",
  "description": "Het officiële bezoekerscentrum van het Langley Research Center van NASA, in Hampton, Virginia.",
  "items": {
    "apollo-csm-block-ii": "Commandomodule Yankee Clipper, gevlogen tijdens Apollo 12 (1969)"
  }
}
