{
  "name": "Калифорнијски научни центар",
  "city": "Лос Анђелес",
  "description": "Научни музеј у Експозишон парку у Лос Анђелесу. Стални дом Space Shuttle Endeavour, Центар за ваздухопловство и свемир Семјуела Ошина, отвара се овде 13. новембра 2026. године.",
  "items": {
    "apollo-csm-block-ii": "Командни модул CM-111, који је летео у оквиру пробног пројекта Apollo–Soyuz (1975)",
    "endeavour": "Space Shuttle Endeavour, постављен усправно у лансирном положају са правим спољним резервоаром и два ракетна појачивача на чврсто гориво",
    "space-shuttle-orbiter": "Space Shuttle Endeavour, постављен усправно у лансирном положају са правим спољним резервоаром и два ракетна појачивача на чврсто гориво",
    "gemini": "Капсула Gemini XI, која је летела (1966)",
    "cargo-dragon-v1": "Теретна капсула Dragon, која је летела до ISS у мисијама CRS-6, CRS-13 и CRS-18"
  }
}
